{
	"is-c3-addon": true,
	"type": "plugin",
	"name": "My text plugin",
	"id": "MyCompany_TextPlugin",
	"version": "1.0.0.0",
	"author": "Scirra",
	"website": "https://www.construct.net",
	"documentation": "https://www.construct.net",
	"description": "Example custom text drawing Construct 3 plugin.",
	"editor-scripts": [
						"plugin.js",
						"type.js",
						"instance.js"
					],
	"file-list": [
		"c3runtime/plugin.js",
		"c3runtime/type.js",
		"c3runtime/instance.js",
		"c3runtime/conditions.js",
		"c3runtime/actions.js",
		"c3runtime/expressions.js",
		"lang/en-US.json",
		"aces.json",
		"addon.json",
		"icon.svg",
		"plugin.js",
		"type.js",
		"instance.js"
	]
}